{"$id":"https://hiri-protocol.org/resources/preview/rhp-2026-07/schemas/trust-config/v1","$schema":"https://json-schema.org/draft/2020-12/schema","additionalProperties":false,"properties":{"acceptedCredentialSchemas":{"maxItems":0,"type":"array"},"artifactResolverOrigins":{"maxItems":0,"type":"array"},"bvsIdentityAnchors":{"maxItems":0,"type":"array"},"bvsTrustTuples":{"maxItems":0,"type":"array"},"canonicalOrigin":{"const":"https://hiri-protocol.org"},"issuerAuthoritativeCurrentHeadOrigins":{"maxItems":0,"type":"array"},"issuerAuthorities":{"maxItems":0,"type":"array"},"issuerIdentityAnchors":{"maxItems":0,"type":"array"},"presentationDeliveryOrigins":{"maxItems":0,"type":"array"},"releaseId":{"const":"real-holder-preview"},"relyingPartyPolicies":{"maxItems":0,"type":"array"},"remoteResourceOrigins":{"maxItems":0,"type":"array"},"verifierIdentityAnchors":{"maxItems":0,"type":"array"}},"required":["canonicalOrigin","releaseId","issuerAuthorities","verifierIdentityAnchors","issuerIdentityAnchors","bvsIdentityAnchors","issuerAuthoritativeCurrentHeadOrigins","artifactResolverOrigins","remoteResourceOrigins","presentationDeliveryOrigins","bvsTrustTuples","acceptedCredentialSchemas","relyingPartyPolicies"],"title":"RHP empty trust configuration baseline","type":"object"}