{"acceptedCredentialSchemas":[],"artifactResolverOrigins":[],"bvsIdentityAnchors":[],"bvsTrustTuples":[],"canonicalOrigin":"https://hiri-protocol.org","issuerAuthoritativeCurrentHeadOrigins":[],"issuerAuthorities":[],"issuerIdentityAnchors":[],"presentationDeliveryOrigins":[],"releaseId":"real-holder-preview","relyingPartyPolicies":[],"remoteResourceOrigins":[],"verifierIdentityAnchors":[]}